Left context;Center;Right context;Publ_year;Sphere;Type;Medium;word_1;class_1;act_1;word_2;class_2;act_2;word_3;class_3;act_3;;Full context
 энергичный, всенародно любимый Владимир Владимирович ; без устали ;строит властную вертикаль, консолидирует ;2003 ;публицистика, нехудожественная ;статья ;журнал ;;;;;;;;;;;" В ней молодой, энергичный, всенародно любимый Владимир Владимирович без устали строит властную вертикаль, консолидирует общество, восстанавливает то, что было разрушено в годы ""лихолетья"".  [Александр Храмчихин. Комплекс полноценности // «Отечественные записки», 2003] [омонимия снята]"
 показом паузой активно пользовались фотокорреспонденты, ; без устали ;"""щелкая"" именитых гостей.  ";2002;публицистика, нехудожественная ;репортаж ;газета ;;;;;;;;;;;"  Возникшей перед показом паузой активно пользовались фотокорреспонденты, без устали ""щелкая"" именитых гостей.  [Эльвира Савкина. Max Мara вывела vip-леди Самары на подиум (2002) // «Дело» (Самара), 2002.05.26] [омонимия снята]"
 днями пилили на скрипочке или ; без устали ;вгрызались цепкими молочными зубами ;2002;публицистика, нехудожественная ;статья ;газета ;;;;;;;;;;;  Конечно, среди гениев были и те, что с пяти лет целыми днями пилили на скрипочке или без устали вгрызались цепкими молочными зубами в Евклидову геометрию.  [Наталья Склярова. Казаки-разбойники (2002) // «Вечерняя Москва», 2002.01.10] [омонимия снята]
 Москву с чернявой, золотозубой и ; без устали ;курившей женой, молодая соседка ;2000 ;художественная ;роман ;журнал ;;;;;;;;;;; Это случилось после того, как в небольшой коммунальной квартире на улице Обуха возле Курского вокзала, где старик жил после переезда в Москву с чернявой, золотозубой и без устали курившей женой, молодая соседка купила своей дочке собаку.  [Алексей Варламов. Купавна // «Новый Мир», 2000] [омонимия снята]
 же ему противился, что, когда ; без устали ;ходившая по исполкомовским комиссиям ;2000 ;художественная ;роман ;журнал ;;;;;;;;;;;" Мама умоляла папу сходить к своему начальству; пугая мальчика, от отчаяния рыдала и твердила, что делает всё ради детей, но папа отказывался и был настолько искренне ли деланно равнодушен к переезду или же ему противился, что, когда без устали ходившая по исполкомовским комиссиям, заседаниям и инстанциям учительница всё же добилась своего и получила ордер, даже не поехал смотреть с таким трудом выменянную квартиру и  первый раз увидел её вместе с Колюней, выпрыгнув из кузова большой крытой машины, что перевозила исцарапанную мебель, холодильник, черно-белый телевизор, цветы в горшках и сложенные в коробки пачки журналов ""Проблемы мира и социализма"""" Юность"" и ""Наука и жизнь"", а также тяжёлые послевоенные однотомные сочинения русских классиков, за безрассудную приверженность к которым Колюню впоследствии без устали долбили бесцеремонные и вздорные люди обоих полов,чем-то похожие  на брезгливых посетителей их первого дома.  [Алексей Варламов. Купавна // «Новый Мир», 2000] [омонимия снята]"
  Ожив, они ; без устали ;поглощают сахар и непрерывно ;2001 ;художественная ;роман ;журнал ;;;;;;;;;;; Ожив, они без устали поглощают сахар и непрерывно размножаются.  [Андрей Волос. Недвижимость (2000) // «Новый Мир», 2001] [омонимия снята]
 же точке мирового пространства, правда ; без устали ;крутя колёсами, чтобы подкатить ;2001 ;художественная ;роман ;журнал ;;;;;;;;;;;ветер  гонит по насту жёлтые и бурые листья, а, напротив, мертво покоится в одной и той же точке мирового пространства, правда без устали крутя колёсами, чтобы подкатить под себя землю.  [Андрей Волос. Недвижимость (2000) // «Новый Мир», 2001] [омонимия снята]
   Как маленькие девочки ; без устали ;переодевают кукол, так и ;2000 ;художественная ;роман ;журнал ;;;;;;;;;;;  Как маленькие девочки без устали переодевают кукол, так и Павел часами собирал и разбирал картонные модели человека и его отдельных органов.  [Людмила Улицкая. Казус Кукоцкого [Путешествие в седьмую сторону света] // «Новый Мир», 2000] [омонимия снята]
 области физиологии и эмбриологии и ; без устали ;поражался неутомимому и даже ;2000 ;художественная ;роман ;журнал ;;;;;;;;;;;  Павел Алексеевич внимательно следил за современными исследованиями в области физиологии и эмбриологии и без устали поражался неутомимому и даже несколько мелочному закону, определяющему жизнь будущего человека ещё в утробе матери, в соответствии с которым каждое улавливаемое событие происходило с великой точностью ? не до недель и дней, а до часов и минут…  [Людмила Улицкая. Казус Кукоцкого [Путешествие в седьмую сторону света] // «Новый Мир», 2000] [омонимия снята]
 носом в землю, копала, полола ; без устали ;устали.  ;2000 ;художественная ;роман ;журнал ;;;;;;;;;;;  Тома, несмотря на мизерность своего сложения, на самом деле тоже была из породы выносливых ? целыми днями возилась со своими зелёными детками, уткнувшись носом в землю, копала, полола без устали.  [Людмила Улицкая. Казус Кукоцкого [Путешествие в седьмую сторону света] // «Новый Мир», 2000] [омонимия снята]
  Без конца, ; без устали ;все талдычат: Россия, Россия ;2000 ;публицистика, нехудожественная ;мемуары ;журнал ;;;;;;;;;;; Без конца, без устали все талдычат: Россия, Россия, величие, величие, свершения и постановления, решения и указания, деньги и благосостояние…  [Виктор Астафьев. Затеси (1999) // «Новый Мир», 2000] [омонимия снята]
 полбуханки хлеба.   А Ринат ; без устали ;искал.   Он приехал в ;2000 ;художественная ;повесть ;книга ;;;;;;;;;;;  Два раза в день ей давали кувшин воды и полбуханки хлеба.   А Ринат без устали искал.   Он приехал в больницу, первую попавшуюся медсестру взял за локоть, отвёл в сторонку и тихо спросил:  [Алексей Слаповский. Гибель гитариста (1994-1995)] [омонимия снята]
   А лягушонок бегал ; без устали ;устали, и голубой звон поднялся ;2000;художественная ;сказка, цикл ;книга ;;;;;;;;;;;  А лягушонок бегал без устали, и голубой звон поднялся уже так высоко, что его слушала вся земля.  [Сергей Козлов. Правда, мы будем всегда? (1969-1981)] [омонимия снята]
  Она ; без устали ;боролась за окружающую среду ;1980 ;художественная ;повесть ;книга ;;;;;;;;;;; Она без устали боролась за окружающую среду, которую постоянно кто-нибудь загрязнял.  [Анатолий Алексин. Раздел имущества (1979)] [омонимия снята]
 беззвучно падающие белые лезвия прожекторов, ; без устали ;разрубающие это утлое мироздание ;1986 ;художественная ;повесть ;книга ;;;;;;;;;;; Мы стояли на краю невидимой бездны и смотрели в небо, где всё переливчато дрожало и напрягалось в ожидании перемены судьбы: звёзды, облака, аэростаты, косо и беззвучно падающие белые лезвия прожекторов, без устали разрубающие это утлое мироздание.  [Юрий Трифонов. Дом на набережной (1976)] [омонимия снята]
 он может три часа танцевать ; без устали ;устали, прочитать за день целиком ;1978 ;художественная ;повесть ;книга ;;;;;;;;;;; Откуда мне знать, нужен ли парню отец, когда у парня рост метр восемьдесят, канадская стрижка, бас, когда он может три часа танцевать без устали, прочитать за день целиком английский детективный роман и подойти на улице к любой девушке и взять у неё телефон?  [Юрий Трифонов. Предварительные итоги (1970)] [омонимия снята]
 меру своих сил, и годами ; без устали ;занимался одним ? писал, писал ;1978 ;художественная ;повесть ;книга ;;;;;;;;;;; Он не гангстер, не половой психопат, он хотел жить, любил женщину, по-своему, в меру своих сил, и годами без устали занимался одним ? писал, писал, писал, писал.  [Юрий Трифонов. Предварительные итоги (1970)] [омонимия снята]
   Таня танцевала ; без устали ;устали, танцевала со всеми подряд ;1965 ;художественная ;роман ;книга ;;;;;;;;;;;  Таня танцевала без устали, танцевала со всеми подряд.  [Василий Аксенов. Пора, мой друг, пора (1963)] [омонимия снята]
 его, люди, до устали и ; без устали ;устали.  ;1979 ;публицистика, нехудожественная ;очерк, цикл ;книга ;;;;;;;;;;;  Катайте его, люди, до устали и без устали.  [И. Ф. Анненский. Вторая книга отражений (1909)] [омонимия снята]
  Когда я работаю подолгу, ; без устали ;устали, тогда мысли полегче, и ;1974 ;художественная ;пьеса ;книга ;;;;;;;;;;; Когда я работаю подолгу, без устали, тогда мысли полегче, и кажется, будто мне тоже известно, для чего я существую.  [А. П. Чехов. Вишневый сад (1904)] [омонимия снята]
  Он ; без устали ;устали, самозабвенно искал приключений и ;2015 ;художественная ;рассказ, цикл ;книга ;;;;;;;;;;; Он без устали, самозабвенно искал приключений и, что самое интересное, находил.  [Дина Рубина. Медная шкатулка (сборник) (2015)] [омонимия не снята]
 треугольном фронтоне с обеих сторон ; без устали ;восходили и восходили к ;2015 ;художественная ;рассказ, цикл ;книга ;;;;;;;;;;; Он стоял в блеске и сини своих мозаик, и золотокрылые ангелы на треугольном фронтоне с обеих сторон без устали восходили и восходили к евангелисту Марку над золотокрылым львом.  [Дина Рубина. Медная шкатулка (сборник) (2015)] [омонимия не снята]
   Голливуд продолжает ; без устали ;раскрывать тему кровососущих гуманоидов ;2014 ;публицистика, нехудожественная ;заметка ;журнал ;;;;;;;;;;;  Голливуд продолжает без устали раскрывать тему кровососущих гуманоидов.  [Вячеслав Суриков. Культура // «Эксперт», 2014] [омонимия не снята]
 за город в зимнюю беспутицу, ; без устали ;помогал горожанам в наведении ;2013 ;публицистика ,  нехудожественная ;статья ;газета ;;;;;;;;;;; Для того, чтобы собрать необходимую фактуру, Илья ел дачный наваристый борщ, мотался за город в зимнюю беспутицу, без устали помогал горожанам в наведении садового марафета, в общем, на полтора года стал своим среди обитателей загородного массива, что раскинулся на девятом километре за Панковкой.  [Мария Клапатнюк. Во саду ли, в огороде… (2013.04.29) // «Новгородские ведомости», 2013] [омонимия не снята]
 праве называться «цивилизованным европейским городом», ; без устали ;проращивает из собственных семян ;2013 ;публицистика, нехудожественная ;очерк ;журнал ;;;;;;;;;;;  Кострома, вероятно, стремясь самоутвердиться в праве называться «цивилизованным европейским городом», без устали проращивает из собственных семян всевозможные аристократические «лилии» и порочные «цветы зла».  [Александр Зябликов. Провинциальная столица // «Сибирские огни», 2013] [омонимия не снята]
 то русские, в основном патриоты, ; без устали ;читали свои стихи ? надрывно ;2013 ;художественная ;рассказ ;журнал ;;;;;;;;;;; И если дрессированные утонченным, но строгим Гарольдом поэты-нацмены вели себя сдержанно, то русские, в основном патриоты, без устали читали свои стихи ? надрывно, со слезой.  [Сергей Каледин. Аллея Руж // «Огонек», 2013] [омонимия не снята]
 быстрый, другой ? невысокий, худой, работающий ; без устали ;устали.  ;2013 ;художественная ;роман ;журнал ;;;;;;;;;;; Один большой, тостоватый и с пузцом, но сильный и быстрый, другой ? невысокий, худой, работающий без устали.  [Виктор Ремизов. Воля вольная // «Новый мир», 2013] [омонимия не снята]
  А еще ; без устали ;любовался ее глазами, ставшими ;2012 ;художественная ;роман ;книга ;;;;;;;;;;; А еще без устали любовался ее глазами, ставшими с беременностью совсем другими.  [Евгений Водолазкин. Лавр (2012)] [омонимия не снята]
   и сердце телеграфирует ; без устали ;всем-всем-всем  ;2012 ;художественная ;роман ;книга ;;;;;;;;;;;  и сердце телеграфирует без устали всем-всем-всем  [Екатерина Завершнева. Высотка (2012)] [омонимия не снята]
 потрясающе-кипящий взрывами гудящий рокот… ; без устали ;устали, без минуты вздоха эта ;2013 ;публицистика, нехудожественная ;биография, записные книжки ;книга ;;;;;;;;;;; Отдавало ли эхо в горах, врывались ли новые батареи в общий страшный хор, только грохот и раскаты росли, сглаживали для уха представление о стрельбе орудий и отдельных батарей и сливались в какой-то потрясающе-кипящий взрывами гудящий рокот… Без устали, без минуты вздоха эта ужасная канонада ревела, стонала, злилась, скрежетала, сея разрушение, гибель и смерть… Две силы бросались глыбами чугуна, свинца и стали…  [А. Г. Колмогоров. Мне доставшееся: Семейные хроники Надежды Лухмановой (2012)] [омонимия не снята]
 устройством дома и продолжением рода ; без устали ;устали.  ;2012 ;публицистика ,  нехудожественная ;статья ;журнал ;;;;;;;;;;; Видна «родовая семья» с хозяйственными заботами, устройством дома и продолжением рода без устали.  [Александр Савинов. «Свидания в огороде и законы Петра I» // «Знание - сила», 2012] [омонимия не снята]
 обязаны своим освобождением тому, что ; без устали ;ублажали жен тех, кто ;2011 ;публицистика, нехудожественная ;статья ;журнал ;;;;;;;;;;; Многие пленные рыцари были обязаны своим освобождением тому, что без устали ублажали жен тех, кто их в плен взял.  [Артур Барсуков. Интим под забралом // «Криминальный отдел», 2011] [омонимия не снята]
  Он ; без устали ;устали, самозабвенно искал приключений и ;2012 ;художественная ;рассказ ;книга ;;;;;;;;;;; Он без устали, самозабвенно искал приключений и, что самое интересное, находил.  [Дина Рубина. Окна (2011)] [омонимия не снята]
 треугольном фронтоне с обеих сторон ; без устали ;восходили и восходили к ;2012 ;художественная ;рассказ ;книга ;;;;;;;;;;; Он стоял в блеске и сини своих мозаик, и золотокрылые ангелы на треугольном фронтоне с обеих сторон без устали восходили и восходили к Евангелисту Марку над золотокрылым львом.  [Дина Рубина. Окна (2011)] [омонимия не снята]
  [Нельсон Мандела, nick]   Прикольный фильм!   Ржал ; без устали ;устали…   Непонятно, чего всем так ; ;электронная коммуникация ,  нехудожественная ;форум ;электронный текст ;;;;;;;;;;; [Нельсон Мандела, nick]   Прикольный фильм!   Ржал без устали…   Непонятно, чего всем так не понравилось.  [коллективный. Форум: Обсуждение фильма «Самый лучший фильм-2» (2009-2011)] [омонимия не снята]
  Осенние волны ; без устали ;бились о скалы у ; ;публицистика, нехудожественная ;мемуары ;книга ;;;;;;;;;;; Осенние волны без устали бились о скалы у ног, ранние сумерки стали сгущаться над океаном, а я все сидел и перебирал листки.  [Иеромонах Макарий (Маркиш). Приключения и подвиги (2010)] [омонимия не снята]
 8 сентября местное еврейское население ; без устали ;славило императора и его ;2010 ;публицистика ,  нехудожественная ;статья ;журнал ;;;;;;;;;;; С этой целью во всех подробностях рассказывалось, как на протяжении 8 сентября местное еврейское население без устали славило императора и его семью, а в завершение торжества оркестр исполнил в синагоге «Боже, царя храни», после чего кантор синагоги с полным хором певчих прочёл молитву о здравии и долгоденствии императора и всего царственного дома.  [Алексей Буслаев. Как пили за здоровье тысячелетия // «Родина», 2010] [омонимия не снята]
