Left context;Center;Right context;Publ_year;Sphere;Type;Medium;word_1;class_1;act_1;word_2;class_2;act_2;word_3;class_3;act_3;;Full context
 девушки, мужчины и женщины примутся ; без устали ;танцевать, сменяя друг друга ;2001;публицистика ,  нехудожественная ;статья ;газета ;;;;;;;;;;;  И едва главный судья в девять утра субботы даст отмашку, как все эти мальчики и девочки, юноши и девушки, мужчины и женщины примутся без устали танцевать, сменяя друг друга на специально положенном в «Олимпийском» паркете.  [Дэнс, дэнс, дэнс. Спорт (2001) // «Известия», 2001.12.06] [омонимия не снята]
  Год она ; без устали ;твердила это, а потом ;2005 ;художественная ;роман ;книга ;;;;;;;;;;; Год она без устали твердила это, а потом исчезла вторично.  [Борис Васильев. Дом, который построил Дед (1990-2000)] [омонимия не снята]
 на морозы, сырой ветер дул ; без устали ;устали, и по всему Питеру ;2005 ;художественная ;роман ;книга ;;;;;;;;;;; Несмотря на морозы, сырой ветер дул без устали, и по всему Питеру желто светили костры.  [Борис Васильев. Дом, который построил Дед (1990-2000)] [омонимия не снята]
 по ней параллельно Мясницкой, шофер ; без устали ;крутил руль ? въезжал на ;2000 ;художественная ;роман ;книга ;;;;;;;;;;; Двигаясь по ней параллельно Мясницкой, шофер без устали крутил руль ? въезжал на тротуар, распугивал прохожих, сигналил…  [Вадим Громов. Компромат для олигарха (2000)] [омонимия не снята]
  И вот мы ; без устали ;бродим по улицам, площадям ;2000 ;публицистика ,  нехудожественная ;мемуары ;книга ;;;;;;;;;;; И вот мы без устали бродим по улицам, площадям и бульварам знаменитого города, подымаемся на Эйфелеву башню, не без волнения подходим к импозантному мемориалу Наполеона, гуляем вдоль бурлящих Елисейских полей, по узкой каменной лестнице взбираемся на вершину собора Парижской богоматери, почтительно стоим у стены Коммунаров на кладбише Пер-Лашез.  [Борис Ефимов. Десять десятилетий (2000)] [омонимия не снята]
 сплошные холодные железки, горло пьет ; без устали ;этот чудесный, никогда не ;2000 ;публицистика ,  нехудожественная ;мемуары ;книга ;;;;;;;;;;;  Пальцы на руках и ногах слиплись в сплошные холодные железки, горло пьет без устали этот чудесный, никогда не изведанный прозрачный напиток: воздух верхних слоев атмосферы».  [Борис Ефимов. Десять десятилетий (2000)] [омонимия не снята]
 ритм, чтобы до глубокой ночи ; без устали ;сообщать энергию и жизнеспособность ;2000 ;художественная ;повесть ;книга ;;;;;;;;;;; Пульс наберет скорость и ритм, чтобы до глубокой ночи без устали сообщать энергию и жизнеспособность своему беспокойному организму.  [Екатерина Маркова. Каприз фаворита (1990-2000)] [омонимия не снята]
 Возила ее на каталке и, ; без устали ;рассказывая смешные веселые истории ;2000 ;художественная ;повесть ;книга ;;;;;;;;;;; Возила ее на каталке и, без устали рассказывая смешные веселые истории, со страхом следила за судорожными подрагиваниями ее полуприкрытых век.  [Екатерина Маркова. Отречение (1990-2000)] [омонимия не снята]
 однако, делать, если Поп пишет ; без устали ;устали, как дурак, в течение ;2001 ;художественная ;рассказ ;книга ;;;;;;;;;;;  Совершенное дерьмо этот отрывок, если честно сказать, но коли честно говорить, то что же, однако, делать, если Поп пишет без устали, как дурак, в течение двадцати лет и просто-напросто уже не умеет занять себя чем-либо другим?..  [Евгений Попов. С чего начинается рассказ о князе Кропоткине (1970-2000)] [омонимия не снята]
 терпение, махала своей волшебной палочкой ; без устали ;устали.  ;2000 ;публицистика ,  нехудожественная ;мемуары ;книга ;;;;;;;;;;;  Фея моей жизни, желая вознаградить за терпение, махала своей волшебной палочкой без устали.  [Виктор Розов. Удивление перед жизнью (1960-2000)] [омонимия не снята]
 шуршало снаружи, как будто кто-то ; без устали ;полоскал белье.  ;2001 ;художественная ;повесть ;книга ;;;;;;;;;;; И все так же ухало, плескалось, чмокало и влажно шуршало снаружи, как будто кто-то без устали полоскал белье.  [Борис Хазанов. Корсар (2000)] [омонимия не снята]
 Некрупные, но жилистые руки работали ; без устали ;и не меняя ритма ;2000 ;художественная ;роман ;журнал ;;;;;;;;;;; Некрупные, но жилистые руки работали без устали и не меняя ритма, будто кроили время по собственной удобной мерке.  [Алан Черчесов. Венок на могилу ветра // «Знамя», 2000] [омонимия не снята]
 на посошок: Борис Пастернак тоже ; без устали ;присягал жизни как поэзии ;1999;публицистика ,  нехудожественная ;статья ;журнал ;;;;;;;;;;;  Вспомним на посошок: Борис Пастернак тоже без устали присягал жизни как поэзии.  [Татьяна Бек. «Их протирают, как стекло» (1999) // «Дружба народов», 1999.07.15] [омонимия не снята]
  Лия ; без устали ;опускала медную сковородку на ;1999 ;художественная ;роман ;книга ;;;;;;;;;;; Лия без устали опускала медную сковородку на лохматые головенки, но уже через пару минут ее ноги были в кровь исколоты маленькими камикадзе.  [Андрей Белянин. Свирепый ландграф (1999)] [омонимия не снята]
 самым ее носом, а она ; без устали ;продолжала преследовать добычу ? даже ;2000 ;художественная ;рассказ ;книга ;;;;;;;;;;; Он то садился, то снова взлетал перед самым ее носом, а она без устали продолжала преследовать добычу ? даже тапки скинула.  [Нина Горланова. Павлиноглазка (1987-1999)] [омонимия не снята]
 пламенеющая готика: каждая деталь прорабатывается ; без устали ;устали, каждой линии противопоставляется контрлиния ; ;учебно-научная ,  нехудожественная ;лекция, цикл ;электронный текст ;;;;;;;;;;; Тому примером и архитектура ? пламенеющая готика: каждая деталь прорабатывается без устали, каждой линии противопоставляется контрлиния, форма дробится и множится.  [С. А. Еремеева. Лекции по истории искусства (1999)] [омонимия не снята]
 еще несколько постановок, и я ; без устали ;пытался «вырастить фонды».  ;1999 ;публицистика ,  нехудожественная ;мемуары ;книга ;;;;;;;;;;; Хотя наш театр сделал еще несколько постановок, и я без устали пытался «вырастить фонды».  [Александр Журбин. Как это делалось в Америке. Автобиографические заметки (1999)] [омонимия не снята]
 жилец, а мозг.   Он работает ; без устали ;  над культур'задачами  ;2002 ;публицистика ,  нехудожественная ;мемуары ;книга ;;;;;;;;;;;  не жилец, а мозг.   Он работает без устали   над культур'задачами  [Василий Катанян. Лиля Брик. Жизнь (1999)] [омонимия не снята]
