Left context;Center;Right context;Publ_year;Sphere;Type;Medium;word_1;class_1;act_1;word_2;class_2;act_2;word_3;class_3;act_3;;Full context
  Я же ; без устали ;бороздил бровку и даже ;2010 ;бытовая ,  нехудожественная ;статья ;журнал ;;;;;;;;;;; Я же без устали бороздил бровку и даже отдал голевой пас.  [Александр Кобеляцкий. Когда пальмы были большими. Как играют в футбол в Африке // «Русский репортер», № 4 (132), 4-11 февраля 2010, 2010] [омонимия не снята]
 протекционизма в США и Европе, ; без устали ;критиковавший другие страны за ;2009 ;публицистика, нехудожественная ;статья ;журнал ;;;;;;;;;;; Министр торговли и промышленности этой страны Алан Джонсон, яростный критик протекционизма в США и Европе, без устали критиковавший другие страны за то, что их государственные деятели вмешиваются в чисто коммерческие вопросы и чинят препятствия иностранным компаниям в вопросах поглощения местных объектов собственности, вдруг поменял риторику.  [Вадим Бондарь. Мы покупаем, нас покупают. Как это часто не совпадает // «Однако», 2009] [омонимия не снята]
  Пока раззадоренные юноши ; без устали ;состязались в танцевальных прыжках ;2010 ;художественная ;повесть ;журнал ;;;;;;;;;;; Пока раззадоренные юноши без устали состязались в танцевальных прыжках и кульбитах, издавая громкое «Арс» и прочие молодецкие крики, худая женщина сосредоточенно ловила бумажные деньги, падавшие невесте на голову, под ноги и в складки платья.  [Гулла Хирачев (Алиса Ганиева). Салам тебе, Далгат! (2009) // «Октябрь», 2010] [омонимия не снята]
  Отец ; без устали ;выдумывал утешительные меры ? начиная ;2010 ;художественная ;роман ;книга ;;;;;;;;;;; Отец без устали выдумывал утешительные меры ? начиная от гена бессмертия до наручного прибора, вроде часов, который будет ежесекундно диагностировать состояние организма человека и время от времени выдавать советы: «Выпить таблетку № 317».  [Александр Иличевский. Перс (2009)] [омонимия не снята]
 восхода и до заката птицы ; без устали ;летают по окрестностям в ;2009 ;публицистика ,  нехудожественная ;статья ;журнал ;;;;;;;;;;; С восхода и до заката птицы без устали летают по окрестностям в поисках пищи.  [Ирина Королёва. Первый шаг во взрослую жизнь // «Наука и жизнь», 2009] [омонимия не снята]
 на старой пишущей машинке «Ремингтон» ; без устали ;печатает его новые произведения ;2009 ;публицистика ,  нехудожественная ;статья ;журнал ;;;;;;;;;;;  Маргарита Константиновна на старой пишущей машинке «Ремингтон» без устали печатает его новые произведения.  [Нелли Кравклис, Михаил Левитин. Три жизни писателя // «Наука и жизнь», 2009] [омонимия не снята]
 находят нужное место лишь ищущие ; без устали ;устали, умеющие ходить невидимыми путями ;2009 ;художественная ;роман ;книга ;;;;;;;;;;; Желающих много, но находят нужное место лишь ищущие без устали, умеющие ходить невидимыми путями, читать тайные знаки и видеть вещие сны.  [Мариам Петросян. Дом, в котором... (2009)] [омонимия не снята]
  Болтаясь в коляске, гость ; без устали ;вертел гуттаперчевой шеей ? в ;2008 ;художественная ;роман ;книга ;;;;;;;;;;; Болтаясь в коляске, гость без устали вертел гуттаперчевой шеей ? в этой жизни его радовало, без исключения, все: и разбитые вдребезги «ИСы», у которых от детонации огромными лепестками вскрывало броневые плиты, и расплющенные штурмовкой эсэсовские броневики.  [Илья Бояшов. Танкист, или «Белый тигр» (2008)] [омонимия не снята]
 в кипящие источники, а Токугава ; без устали ;награждал наиболее отличившихся своей ;2008 ;художественная ;роман ;книга ;;;;;;;;;;;  Оставшихся в живых защитников крепости Симабара закапывали живьем в землю, распинали, рубили на части, бросали в кипящие источники, а Токугава без устали награждал наиболее отличившихся своей жестокостью вассалов.  [Андрей Геласимов. Степные боги (2008)] [омонимия не снята]
 всё побережье, и каждый моллюск ; без устали ;фильтрует воду.  ;2008 ;публицистика ,  нехудожественная ;статья ;журнал ;;;;;;;;;;;"  В Белом море мидии населяют приливно-отливную зону и самые верхние горизонты необсыхающего мелководья; пояс их поселений окаймляет всё побережье, и каждый моллюск без устали фильтрует воду.  [Е. Краснова. 70 лет у полярного круга. Вторая молодость беломорской биостанции // «Наука и жизнь», 2008] [омонимия не снята]"
 и сколько б ни выпили, ; без устали ;читали стихи, а потом ;2009 ;публицистика, нехудожественная ;мемуары ;книга ;;;;;;;;;;; Но, сколько б ни пили и сколько б ни выпили, без устали читали стихи, а потом хозяин дал нам желтоватые, уже чуть ломкие листки, исписанные знакомым почерком, таинственно предупредив: мы ? первые, кому он их доверяет.  [С. Б. Рассадин. Книга прощаний. Воспоминания о друзьях и не только о них (2004-2008)] [омонимия не снята]
 новым блогам Hakan'а, который ; без устали ;комментировал все самые громкие ;2008 ;художественная ;рассказ ;книга ;;;;;;;;;;; С современностью он мог сверяться по регулярно появляющимся новым блогам Hakan'а, который без устали комментировал все самые громкие и абсурдные события российской жизни.  [Герман Садулаев. Таблетка (2008)] [омонимия не снята]
 мне снова и снова, я ; без устали ;слушать готова, трам-драм ;2009 ;художественная ;роман ;книга ;;;;;;;;;;; Говорите мне о любви, говорите мне снова и снова, я без устали слушать готова, трам-драм, зови!  [Василий Аксенов. Таинственная страсть (2007)] [омонимия не снята]
 снобизм, равно как и особенность ; без устали ;шагать по горам милю ;2007 ;художественная ;роман ;книга ;;;;;;;;;;; Его снобизм, равно как и особенность без устали шагать по горам милю за милей, в конце концов оказались красной тряпкой даже для самых миролюбивых.  [Илья Бояшов. Путь Мури (2007)] [омонимия не снята]
 не вылезая из бассейна и ; без устали ;подвергая своих подопечных всевозможным ;2007 ;художественная ;роман ;книга ;;;;;;;;;;; Океанолог Джон Дили, не вылезая из бассейна и без устали подвергая своих подопечных всевозможным опытам, обещал ему долгожданный прорыв.  [Илья Бояшов. Путь Мури (2007)] [омонимия не снята]
 с птицами, но и бежать ; без устали ;много дней особым скоком ;2009 ;художественная ;роман ;книга ;;;;;;;;;;; О, брат Мамур умеет не только взвиваться в воздух и сидеть рядом с птицами, но и бежать без устали много дней особым скоком.  [Михаил Гиголашвили. Чертово колесо (2007)] [омонимия не снята]
 мог быть необычайно нежен, целовал ; без устали ;устали, я нутром ощущала его ;2009 ;художественная ;повесть ;журнал ;;;;;;;;;;; Зверь мог быть необычайно нежен, целовал без устали, я нутром ощущала его, и он так же хорошо угадывал мой готовящийся обвал.  [Михаил Гиголашвили. Экобаба и дикарь (1998-2007) // «Зарубежные записки», 2009] [омонимия не снята]
 испытывает жажды мщенья, всегда сконцентрирован, ; без устали ;использует все свои возможности ;2007 ;публицистика ,  нехудожественная ;статья ;журнал ;;;;;;;;;;; Он не испытывает жажды мщенья, всегда сконцентрирован, без устали использует все свои возможности.  [Е. Гик. Шахматы в художественной литературе // «Наука и жизнь», 2007] [омонимия не снята]
 яркий живой металл, который плясал ; без устали ;устали, желая вырваться из тесных ;2007 ;художественная ;рассказ ;книга ;;;;;;;;;;; Они и были ? яркий живой металл, который плясал без устали, желая вырваться из тесных объятий горна.  [Юрий Гордиенко. Мы нарисовали небо (2007)] [омонимия не снята]
 психологически, забыв, что раньше они ; без устали ;махали ломами и топорами ;2008 ;художественная ;роман ;книга ;;;;;;;;;;; Женщины дряхлели психологически, забыв, что раньше они без устали махали ломами и топорами на стройках, таскали шпалы и части рельсов на железнодорожных работах, волокли ведра и носилки, полные неподъемного раствора.  [Михаил Елизаров. Библиотекарь (2007)] [омонимия не снята]
  И все они исправно, ; без устали ;устали, едва ли не всякий ;2008 ;художественная ;рассказ ;журнал ;;;;;;;;;;; И все они исправно, без устали, едва ли не всякий день демонстрировали свою фамильную малограмотность, свои неверные ударения, свою родную незамысловатость ? все ту же социальную близость!  [Леонид Зорин. Медный закат (2007) // «Знамя», 2008] [омонимия не снята]
  Читай.  Читай ; без устали ;устали.  Решай кроссворды.  ;2007 ;художественная ;роман ;журнал ;;;;;;;;;;; Читай.  Читай без устали.  Решай кроссворды.  [Александр Иличевский. Матисс // «Новый Мир», 2007] [омонимия не снята]
  Вены города ; без устали ;гнали тёмную кровь, но ;2007 ;художественная ;рассказ ;книга ;;;;;;;;;;; Вены города без устали гнали тёмную кровь, но куда она уходила, оставалось загадкой.  [Дмитрий Колодан, Карина Шаинян. Над бездной вод (2007)] [омонимия не снята]
 засаленными обоями, стучал на машинке ; без устали ;устали.  ;2006 ;публицистика ,  нехудожественная ;мемуары ;книга ;;;;;;;;;;;  Покойный филологический академик Аверинцев, примерно такой же великий, как ваш математический Арнольд, рассказывал мне, что все это лето он просидел взаперти в своем кабинетике с засаленными обоями, стучал на машинке без устали.  [Александр Архангельский. 1962. Послание к Тимофею (2006)] [омонимия не снята]
 Почему корова преклонного возраста продолжает ; без устали ;поставлять молоко, да еще ;2006 ;публицистика ,  нехудожественная ;заметка ;журнал ;;;;;;;;;;; Почему корова преклонного возраста продолжает без устали поставлять молоко, да еще в таких количествах?  [Как мало мы о них знаем // «Знание - сила», 2006] [омонимия не снята]
 любовно смотрела на него, часами ; без устали ;вела беседы то об ;1997 ;художественная ;роман ;книга ;;;;;;;;;;; Привозила Саше сначала игрушки, потом коньки и клюшки, любовно смотрела на него, часами без устали вела беседы то об индейцах Америки, то о водителях фрегатов, то о мировой политической арене.  [Василий Аксенов. Новый сладостный стиль (2005)] [омонимия не снята]
 это новшество и жалел ее ; без устали ;устали.  ;1997 ;художественная ;роман ;книга ;;;;;;;;;;; Он откликался на это новшество и жалел ее без устали.  [Василий Аксенов. Новый сладостный стиль (2005)] [омонимия не снята]
   Внизу, во дворе гостиницы, ; без устали ;играющий на аккордеоне начпрод ;2005 ;художественная ;роман ;книга ;;;;;;;;;;;  Внизу, во дворе гостиницы, без устали играющий на аккордеоне начпрод завел вальс «На сопках Маньчжурии».  [Вацлав Михальский. Для радости нужны двое (2005)] [омонимия не снята]
 вращали там жернова, и механик ; без устали ;пускался пешим в дальние ;2009 ;художественная ;рассказ ;книга ;;;;;;;;;;;  «Машина» разрасталась, ее ремни достигли дальних земель и вращали там жернова, и механик без устали пускался пешим в дальние дороги: стыдить непокорных князей, устраивать монастыри и церкви, крестить великокняжеских сыновей.  [Александр Терехов. Коммуналка (1995-2005)] [омонимия не снята]
  Подростки и молодежь ; без устали ;бегали гуськом вдоль зрителей ;2004;публицистика ,  нехудожественная ;репортаж ;журнал ;;;;;;;;;;; Подростки и молодежь без устали бегали гуськом вдоль зрителей, пришедших посмотреть концерт народных коллективов.  [Ольга Акулова, Герман Арутюнов. «Широкая Масленица» в Москве (2004) // «Народное творчество», 2004.02.16] [омонимия не снята]
  Муж ; без устали ;знакомил меня с любимыми ;2004 ;публицистика ,  нехудожественная ;мемуары ;книга ;;;;;;;;;;; Муж без устали знакомил меня с любимыми местами.  [Лидия Вертинская. Синяя птица любви (2004)] [омонимия не снята]
 драгоценные стеклышки, будет перебирать их ; без устали ;устали.  ;1987 ;художественная ;роман ;книга ;;;;;;;;;;; Спросите любого, было ли у него в жизни что-нибудь счастливое, безмятежное, и он, конечно, вспомнит свою повозочку, свою няньку, свою матушку, укутывающую его беличьим одеяльцем, вытряхнет из заветного мешочка свои, ему лишь одному драгоценные стеклышки, будет перебирать их без устали.  [Михаил Шишкин. Всех ожидает одна ночь (1993-2003)] [омонимия не снята]
 ранней весны до глубокой осени, ; без устали ;перенося на холст притягательную ;2003;публицистика ,  нехудожественная ;заметка ;журнал ;;;;;;;;;;; Купил небольшой домишко и обитал в нем с ранней весны до глубокой осени, без устали перенося на холст притягательную красоту здешних мест.  [«Утонченной жизни цвет» (2003) // «Сельская новь», 2003.12.16] [омонимия не снята]
 Вообще, японцы верны себе и ; без устали ;изобретают всевозможные полезные диковинки ;2003;публицистика ,  нехудожественная ;заметка ;журнал ;;;;;;;;;;;  Вообще, японцы верны себе и без устали изобретают всевозможные полезные диковинки.  [Бессмертные джинсы (2003) // «100% здоровья», 2003.02.14] [омонимия не снята]
 продолжают хранить тибетские традиции и ; без устали ;работать над собой.  ;2003 ;публицистика ,  нехудожественная ;заметка ;газета ;;;;;;;;;;; Там, на юге страны, он воссоздали монастырь, где монахи продолжают хранить тибетские традиции и без устали работать над собой.  [Монастырь Гьюдмед // «Пятое измерение», 2003] [омонимия не снята]
 машин было штук двадцать, помпы ; без устали ;качали воду Невы, бойцы ;2002 ;публицистика ,  нехудожественная ;мемуары ;журнал ;;;;;;;;;;; Пожарных машин было штук двадцать, помпы без устали качали воду Невы, бойцы ломали крышу, но пламя распространялось меж перекрытиями и по каналам старой системы печного отопления.  [Владимир Арро. Дом прибежища // «Звезда», 2002] [омонимия не снята]
 грязь и мерзость конкретного человека ? ; без устали ;воспевал человека абстрактного, никем ;2003 ;художественная ;роман ;книга ;;;;;;;;;;;" Чтобы уравновесить это жестокое зрение, он постоянно впадал в экзальтацию и пафос; видя всю грязь и мерзость конкретного человека ? без устали воспевал человека абстрактного, никем не виданного, небывалого.  [Дмитрий Быков. Орфография (2002)] [омонимия не снята]"
  Работала Доронина ; без устали ;устали, на губах все чаще ;2002 ;публицистика ,  нехудожественная ;мемуары ;журнал ;;;;;;;;;;; Работала Доронина без устали, на губах все чаще появлялась невеселая улыбка.  [Виталий Вульф. Преодоление себя (из книги «Серебряный шар») // «Октябрь», 2002] [омонимия не снята]
 Абсолютное превосходство исключало зависть, которая ; без устали ;примеряется и сравнивает.  ;2002 ;художественная ;роман ;журнал ;;;;;;;;;;;  Абсолютное превосходство исключало зависть, которая без устали примеряется и сравнивает.  [Сергей Гандлевский. НРЗБ // «Знамя», 2002] [омонимия не снята]
 Но разве не древнейшие ваятели ; без устали ;творили их, покрывая песок ;2002 ;публицистика ,  нехудожественная ;монография ;книга ;;;;;;;;;;; Но разве не древнейшие ваятели без устали творили их, покрывая песок тончайшей сканью ? кажется, лишь для того, чтобы через несколько часов, смыв сотворенное приливной волной, вновь приступить к работе, играючи бахвалясь друг перед другом своим мастерством?  [Василий Голованов. Остров, или оправдание бессмысленных путешествий (2002)] [омонимия не снята]
